98,247,"CANDY_-_CHECKLANE WATER_-_CARBONATED/FLVRD_DRINK COOKIES/CONES CHICKEN",17.06,7.54,2,11,0,0,1,0,0,0,0,0,1,0,0,1,0,0,0,0,0,0,0,0,0,0,0,0,0,1,1,0,0,0,0,0,0,1,0,0,0,1,0,0,0,10.33,11.32,8,0.0654622790686673,0.117936212294765
98,249,"BAG_SNACKS DRY_BN/VEG/POTATO/RICE DINNER_MXS:DRY SEAFOOD_-_SHELF_STABLE REFRGRATD_JUICES/DRNKS SHORTENING/OIL BAKED_BREAD/BUNS/ROLLS",7.54,12.45,7,7,0,0,1,0,0,0,0,0,1,0,0,1,0,0,0,0,0,0,0,0,0,0,0,0,0,1,1,0,0,0,0,0,0,1,0,0,0,1,0,0,0,10.33,11.32,2,0.0654622790686673,0.117936212294765
98,256,"CANDY_-_CHECKLANE DISHWASH_DETERGENTS WATER_-_CARBONATED/FLVRD_DRINK LAUNDRY_DETERGENTS BATH_TISSUES",12.45,2.19,8,8,0,0,1,0,0,0,0,0,1,0,0,1,0,0,0,0,0,0,0,0,0,0,0,0,0,1,1,0,0,0,0,0,0,1,0,0,0,1,0,0,0,10.33,11.32,7,0.0654622790686673,0.117936212294765
98,264,"BAG_SNACKS CHEESE BAKED_BREAD/BUNS/ROLLS",2.19,15.48,6,3,0,0,1,0,0,0,0,0,1,0,0,1,0,0,0,0,0,0,0,0,0,0,0,0,0,1,1,0,0,0,0,0,0,1,0,0,0,1,0,0,0,10.33,11.32,8,0.0654622790686673,0.117936212294765
98,270,"CITRUS SUGARS/SWEETNERS BAG_SNACKS REFRGRATD_JUICES/DRNKS COOKIES/CONES SALD_DRSNG/SNDWCH_SPRD CANDY_-_PACKAGED BATH_TISSUES",15.48,5.46,14,13,0,0,1,0,0,0,0,0,1,0,0,1,0,0,0,0,0,0,0,0,0,0,0,0,0,1,1,0,0,0,0,0,0,1,0,0,0,1,0,0,0,10.33,11.32,6,0.0654622790686673,0.117936212294765
98,284,"FOOT_CARE_PRODUCTS SOFT_DRINKS BATH_TISSUES",5.46,25.43,9,4,0,0,1,0,0,0,0,0,1,0,0,1,0,0,0,0,0,0,0,0,0,0,0,0,0,1,1,0,0,0,0,0,0,1,0,0,0,1,0,0,0,10.33,11.32,14,0.0654622790686673,0.117936212294765
98,293,"SHORTENING/OIL SOUP FROZEN_PIE/DESSERTS SOFT_DRINKS BAKED_BREAD/BUNS/ROLLS FRZN_POTATOES BAKING_NEEDS MEAT_SUPPLIES BAKED_SWEET_GOODS BAG_SNACKS CANDY_-_CHECKLANE FRZN_MEAT/MEAT_DINNERS",25.43,4.27,2,25,0,0,1,0,0,0,0,0,1,0,0,1,0,0,0,0,0,0,0,0,0,0,0,0,0,1,1,0,0,0,0,0,0,1,0,0,0,1,0,0,0,10.33,11.32,9,0.0654622790686673,0.117936212294765
98,295,"SOFT_DRINKS STATIONERY_&_SCHOOL_SUPPLIES BATH_TISSUES",4.27,66.33,10,4,0,0,1,0,0,0,0,0,1,0,0,1,0,0,0,0,0,0,0,0,0,0,0,0,0,1,1,0,0,0,0,0,0,1,0,0,0,1,0,0,0,10.33,11.32,2,0.0654622790686673,0.117936212294765
98,305,"NON-DAIRY_BEVERAGES CANNED_JUICES REFRGRATD_JUICES/DRNKS FRZN_NOVELTIES/WTR_ICE SALD_DRSNG/SNDWCH_SPRD FRZN_VEGETABLE/VEG_DSH DINNER_SAUSAGE SEAFOOD_-_SHELF_STABLE WAREHOUSE_SNACKS SOUP MEAT_-_SHELF_STABLE DRY_BN/VEG/POTATO/RICE FRZN_POTATOES EGGS COLD_CEREAL CEREAL/BREAKFAST CHICKEN CANDY_-_CHECKLANE COOKIES/CONES COUPONS/STORE_&_MFG BAKED_SWEET_GOODS CONVENIENT_BRKFST/WHLSM_SNACKS PAPER_TOWELS SOFT_DRINKS BAKED_BREAD/BUNS/ROLLS PORK",66.33,14.39,2,48,0,0,1,0,0,0,0,0,1,0,0,1,0,0,0,0,0,0,0,0,0,0,0,0,0,1,1,0,0,0,0,0,0,1,0,0,0,1,0,0,0,10.33,11.32,10,0.0654622790686673,0.117936212294765
98,307,"SOUP BAKED_BREAD/BUNS/ROLLS DINNER_SAUSAGE PORK MARGARINES FRZN_VEGETABLE/VEG_DSH REFRGRATD_JUICES/DRNKS FRZN_POTATOES BAKED_SWEET_GOODS LUNCHMEAT BEEF",14.39,3.37,4,18,0,0,1,0,0,0,0,0,1,0,0,1,0,0,0,0,0,0,0,0,0,0,0,0,0,1,1,0,0,0,0,0,0,1,0,0,0,1,0,0,0,10.33,11.32,2,0.0654622790686673,0.117936212294765
98,311,"SOFT_DRINKS REFRGRATD_JUICES/DRNKS CANDY_-_CHECKLANE",3.37,9.71,8,3,0,0,1,0,0,0,0,0,1,0,0,1,0,0,0,0,0,0,0,0,0,0,0,0,0,1,1,0,0,0,0,0,0,1,0,0,0,1,0,0,0,10.33,11.32,4,0.0654622790686673,0.117936212294765
98,319,"CANDY_-_CHECKLANE WATER_-_CARBONATED/FLVRD_DRINK",9.71,23.08,1,12,0,0,1,0,0,0,0,0,1,0,0,1,0,0,0,0,0,0,0,0,0,0,0,0,0,1,1,0,0,0,0,0,0,1,0,0,0,1,0,0,0,10.33,11.32,8,0.0654622790686673,0.117936212294765
98,320,"PWDR/CRYSTL_DRNK_MX BAG_SNACKS BAKED_SWEET_GOODS CONVENIENT_BRKFST/WHLSM_SNACKS BEERS/ALES",23.08,9.2,4,12,0,0,1,0,0,0,0,0,1,0,0,1,0,0,0,0,0,0,0,0,0,0,0,0,0,1,1,0,0,0,0,0,0,1,0,0,0,1,0,0,0,10.33,11.32,1,0.0654622790686673,0.117936212294765
98,324,"FRZN_NOVELTIES/WTR_ICE COFFEE REFRGRATD_JUICES/DRNKS MARGARINES CANDY_-_CHECKLANE EGGS",9.2,13.56,16,6,0,0,1,0,0,0,0,0,1,0,0,1,0,0,0,0,0,0,0,0,0,0,0,0,0,1,1,0,0,0,0,0,0,1,0,0,0,1,0,0,0,10.33,11.32,4,0.0654622790686673,0.117936212294765
98,340,"POPCORN PORK VEGETABLES_SALAD FRZN_MEAT/MEAT_DINNERS CANDY_-_CHECKLANE BAKED_SWEET_GOODS TOMATOES SOFT_DRINKS",13.56,12.28,2,12,0,0,1,0,0,0,0,0,1,0,0,1,0,0,0,0,0,0,0,0,0,0,0,0,0,1,1,0,0,0,0,0,0,1,0,0,0,1,0,0,0,10.33,11.32,16,0.0654622790686673,0.117936212294765
98,342,"DINNER_SAUSAGE BAKED_BREAD/BUNS/ROLLS FRZN_MEAT/MEAT_DINNERS PASTA_SAUCE DRY_BN/VEG/POTATO/RICE ISOTONIC_DRINKS",12.28,1,8,9,0,0,1,0,0,0,0,0,1,0,0,1,0,0,0,0,0,0,0,0,0,0,0,0,0,1,1,0,0,0,0,0,0,1,0,0,0,1,0,0,0,10.33,11.32,2,0.0654622790686673,0.117936212294765
98,350,"CANDY_-_CHECKLANE",1,14.87,1,3,0,0,1,0,0,0,0,0,1,0,0,1,0,0,0,0,0,0,0,0,0,0,0,0,0,1,1,0,0,0,0,0,0,1,0,0,0,1,0,0,0,10.33,11.32,8,0.0654622790686673,0.117936212294765
98,351,"LAUNDRY_ADDITIVES LAUNDRY_DETERGENTS",14.87,16.86,4,3,0,0,1,0,0,0,0,0,1,0,0,1,0,0,0,0,0,0,0,0,0,0,0,0,0,1,1,0,0,0,0,0,0,1,0,0,0,1,0,0,0,10.33,11.32,1,0.0654622790686673,0.117936212294765
98,355,"BAKED_BREAD/BUNS/ROLLS TOMATOES VEGETABLES_SALAD REFRGRATD_JUICES/DRNKS DRY_BN/VEG/POTATO/RICE CHICKEN CANDY_-_CHECKLANE SHORTENING/OIL",16.86,6.28,3,15,0,0,1,0,0,0,0,0,1,0,0,1,0,0,0,0,0,0,0,0,0,0,0,0,0,1,1,0,0,0,0,0,0,1,0,0,0,1,0,0,0,10.33,11.32,4,0.0654622790686673,0.117936212294765
98,358,"REFRGRATD_JUICES/DRNKS DRY_BN/VEG/POTATO/RICE FRZN_MEAT/MEAT_DINNERS SEAFOOD_-_SHELF_STABLE BAKED_SWEET_GOODS",6.28,27.39,1,6,0,0,1,0,0,0,0,0,1,0,0,1,0,0,0,0,0,0,0,0,0,0,0,0,0,1,1,0,0,0,0,0,0,1,0,0,0,1,0,0,0,10.33,11.32,3,0.0654622790686673,0.117936212294765
98,359,"HOT_DOGS DRY_NOODLES/PASTA FRZN_VEGETABLE/VEG_DSH COLD_CEREAL SEAFOOD_-_SHELF_STABLE EGGS BACON LUNCHMEAT PORK REFRGRATD_JUICES/DRNKS SUGARS/SWEETNERS DIAPERS_&_DISPOSABLES ISOTONIC_DRINKS",27.39,1.09,12,15,0,0,1,0,0,0,0,0,1,0,0,1,0,0,0,0,0,0,0,0,0,0,0,0,0,1,1,0,0,0,0,0,0,1,0,0,0,1,0,0,0,10.33,11.32,1,0.0654622790686673,0.117936212294765
98,371,"CANDY_-_CHECKLANE BAKED_BREAD/BUNS/ROLLS",1.09,28.16,25,2,0,0,1,0,0,0,0,0,1,0,0,1,0,0,0,0,0,0,0,0,0,0,0,0,0,1,1,0,0,0,0,0,0,1,0,0,0,1,0,0,0,10.33,11.32,12,0.0654622790686673,0.117936212294765
98,396,"SOUP DRY_BN/VEG/POTATO/RICE COOKIES/CONES MARGARINES VEGETABLES_SALAD VEGETABLES_-_SHELF_STABLE CANDY_-_CHECKLANE SEAFOOD_-_SHELF_STABLE REFRGRATD_JUICES/DRNKS TOMATOES COLD_CEREAL SHORTENING/OIL HOT_DOGS BATH_TISSUES DRIED_FRUIT SPICES_&_EXTRACTS NON-DAIRY_BEVERAGES PORK TURKEY BAKED_BREAD/BUNS/ROLLS",28.16,6.43,5,26,0,0,1,0,0,0,0,0,1,0,0,1,0,0,0,0,0,0,0,0,0,0,0,0,0,1,1,0,0,0,0,0,0,1,0,0,0,1,0,0,0,10.33,11.32,25,0.0654622790686673,0.117936212294765
98,401,"BLEACH FRZN_MEAT/MEAT_DINNERS BATH_TISSUES STATIONERY_&_SCHOOL_SUPPLIES WATER_-_CARBONATED/FLVRD_DRINK BAG_SNACKS",6.43,3.98,2,6,0,0,1,0,0,0,0,0,1,0,0,1,0,0,0,0,0,0,0,0,0,0,0,0,0,1,1,0,0,0,0,0,0,1,0,0,0,1,0,0,0,10.33,11.32,5,0.0654622790686673,0.117936212294765
117,198,"PAPER_HOUSEWARES WATER_-_CARBONATED/FLVRD_DRINK GRAPES HOT_DOGS CONDIMENTS/SAUCES MILK_BY-PRODUCTS VEGETABLES_-_SHELF_STABLE COOKIES/CONES BAKED_BREAD/BUNS/ROLLS CANDY_-_CHECKLANE BAG_SNACKS YOGURT",23.73,22,4,21,0,0,0,0,0,1,0,1,0,0,0,1,0,0,0,0,0,0,0,0,0,0,1,0,0,0,0,0,1,0,0,0,0,1,0,0,0,0,0,0,1,25.87,8.11,2,0.0647618934095358,0.0433226227690525
117,202,"PASTA_SAUCE POTATOES BAKED_BREAD/BUNS/ROLLS VEGETABLES_-_SHELF_STABLE TROPICAL_FRUIT FLUID_MILK_PRODUCTS YOGURT DOG_FOODS",22,37.58,3,13,0,0,0,0,0,1,0,1,0,0,0,1,0,0,0,0,0,0,0,0,0,0,1,0,0,0,0,0,1,0,0,0,0,1,0,0,0,0,0,0,1,25.87,8.11,4,0.0647618934095358,0.0433226227690525
117,205,"BEEF HOT_CEREAL TOMATOES SOUP REFRGRATD_DOUGH_PRODUCTS BAKING_MIXES POPCORN FROZEN_BREAD/DOUGH VEGETABLES_-_SHELF_STABLE PORK SNACK_NUTS WATER_-_CARBONATED/FLVRD_DRINK APPLES TROPICAL_FRUIT PEARS COFFEE BAKED_BREAD/BUNS/ROLLS",37.58,7.27,6,18,0,0,0,0,0,1,0,1,0,0,0,1,0,0,0,0,0,0,0,0,0,0,1,0,0,0,0,0,1,0,0,0,0,1,0,0,0,0,0,0,1,25.87,8.11,3,0.0647618934095358,0.0433226227690525
117,211,"GRAPES POTATOES CANDY_-_CHECKLANE TROPICAL_FRUIT FRUIT_-_SHELF_STABLE YOGURT",7.27,8.99,5,7,0,0,0,0,0,1,0,1,0,0,0,1,0,0,0,0,0,0,0,0,0,0,1,0,0,0,0,0,1,0,0,0,0,1,0,0,0,0,0,0,1,25.87,8.11,6,0.0647618934095358,0.0433226227690525
117,216,"GRAPES CRACKERS/MISC_BKD_FD SPICES_&_EXTRACTS BAKED_SWEET_GOODS BAKED_BREAD/BUNS/ROLLS",8.99,18.09,2,8,0,0,0,0,0,1,0,1,0,0,0,1,0,0,0,0,0,0,0,0,0,0,1,0,0,0,0,0,1,0,0,0,0,1,0,0,0,0,0,0,1,25.87,8.11,5,0.0647618934095358,0.0433226227690525
117,218,"GRAPES SOFT_DRINKS CRACKERS/MISC_BKD_FD COOKIES/CONES FLUID_MILK_PRODUCTS POTATOES SHORTENING/OIL LUNCHMEAT DISHWASH_DETERGENTS",18.09,23.29,5,12,0,0,0,0,0,1,0,1,0,0,0,1,0,0,0,0,0,0,0,0,0,0,1,0,0,0,0,0,1,0,0,0,0,1,0,0,0,0,0,0,1,25.87,8.11,2,0.0647618934095358,0.0433226227690525
117,223,"DINNER_MXS:DRY SOUP COCOA_MIXES FLUID_MILK_PRODUCTS FRUIT_-_SHELF_STABLE BAKED_SWEET_GOODS APPLES FRZN_BREAKFAST_FOODS SNACK_NUTS WATER_-_CARBONATED/FLVRD_DRINK CHICKEN TROPICAL_FRUIT VITAMINS",23.29,16.82,13,15,0,0,0,0,0,1,0,1,0,0,0,1,0,0,0,0,0,0,0,0,0,0,1,0,0,0,0,0,1,0,0,0,0,1,0,0,0,0,0,0,1,25.87,8.11,5,0.0647618934095358,0.0433226227690525
117,236,"SOFT_DRINKS FROZEN_PIE/DESSERTS BAKING_MIXES DRY_MIX_DESSERTS TROPICAL_FRUIT LUNCHMEAT BAG_SNACKS CANDY_-_PACKAGED BAKED_BREAD/BUNS/ROLLS HALLOWEEN",16.82,90.9,5,15,0,0,0,0,0,1,0,1,0,0,0,1,0,0,0,0,0,0,0,0,0,0,1,0,0,0,0,0,1,0,0,0,0,1,0,0,0,0,0,0,1,25.87,8.11,13,0.0647618934095358,0.0433226227690525
117,241,"MARGARINES MILK_BY-PRODUCTS PICKLE/RELISH/PKLD_VEG ICE_CREAM/MILK/SHERBTS DRY_SAUCES/GRAVY DINNER_MXS:DRY DRY_BN/VEG/POTATO/RICE SALD_DRSNG/SNDWCH_SPRD PNT_BTR/JELLY/JAMS REFRGRATD_DOUGH_PRODUCTS SOFT_DRINKS PAPER_TOWELS CHEESE CRACKERS/MISC_BKD_FD HAIR_CARE_PRODUCTS PAPER_HOUSEWARES FRZN_VEGETABLE/VEG_DSH SPICES_&_EXTRACTS VEGETABLES_-_ALL_OTHERS VEGETABLES_-_SHELF_STABLE DRY_NOODLES/PASTA FLUID_MILK_PRODUCTS HOUSEHOLD_CLEANG_NEEDS LAUNDRY_DETERGENTS DOG_FOODS BAKED_BREAD/BUNS/ROLLS SMOKED_MEATS",90.9,59.42,4,51,0,0,0,0,0,1,0,1,0,0,0,1,0,0,0,0,0,0,0,0,0,0,1,0,0,0,0,0,1,0,0,0,0,1,0,0,0,0,0,0,1,25.87,8.11,5,0.0647618934095358,0.0433226227690525
117,245,"FLOUR_&_MEALS ONIONS HOT_CEREAL TURKEY COCOA_MIXES TOMATOES CANNED_JUICES SOUP CHEESE FROZEN_BREAD/DOUGH CONDIMENTS/SAUCES EGGS BACON POTATOES SNACK_NUTS WATER_-_CARBONATED/FLVRD_DRINK SHORTENING/OIL ICE_CREAM/MILK/SHERBTS BAKED_BREAD/BUNS/ROLLS BAG_SNACKS REFRGRATD_DOUGH_PRODUCTS",59.42,11.83,6,29,0,0,0,0,0,1,0,1,0,0,0,1,0,0,0,0,0,0,0,0,0,0,1,0,0,0,0,0,1,0,0,0,0,1,0,0,0,0,0,0,1,25.87,8.11,4,0.0647618934095358,0.0433226227690525
117,251,"SHORTENING/OIL FROZEN_PIE/DESSERTS FRZN_MEAT/MEAT_DINNERS BAKING_MIXES FLUID_MILK_PRODUCTS BAKED_BREAD/BUNS/ROLLS SUGARS/SWEETNERS TROPICAL_FRUIT WATER_-_CARBONATED/FLVRD_DRINK",11.83,15.77,5,11,0,0,0,0,0,1,0,1,0,0,0,1,0,0,0,0,0,0,0,0,0,0,1,0,0,0,0,0,1,0,0,0,0,1,0,0,0,0,0,0,1,25.87,8.11,6,0.0647618934095358,0.0433226227690525
117,256,"HOT_CEREAL CANDY_-_PACKAGED COCOA_MIXES FROZEN_MEAT CARROTS SOUP SALAD_MIX DRY_MIX_DESSERTS WATER_-_CARBONATED/FLVRD_DRINK VEGETABLES_-_SHELF_STABLE TROPICAL_FRUIT",15.77,20.81,5,11,0,0,0,0,0,1,0,1,0,0,0,1,0,0,0,0,0,0,0,0,0,0,1,0,0,0,0,0,1,0,0,0,0,1,0,0,0,0,0,0,1,25.87,8.11,5,0.0647618934095358,0.0433226227690525
117,261,"BAKED_BREAD/BUNS/ROLLS FROZEN_MEAT TOMATOES FRZN_BREAKFAST_FOODS REFRGRATD_DOUGH_PRODUCTS FRUIT_-_SHELF_STABLE BREAKFAST_SAUSAGE/SANDWICHES TROPICAL_FRUIT REFRIGERATED BEEF",20.81,30.39,14,10,0,0,0,0,0,1,0,1,0,0,0,1,0,0,0,0,0,0,0,0,0,0,1,0,0,0,0,0,1,0,0,0,0,1,0,0,0,0,0,0,1,25.87,8.11,5,0.0647618934095358,0.0433226227690525
117,275,"COCOA_MIXES MARGARINES PNT_BTR/JELLY/JAMS WATER_-_CARBONATED/FLVRD_DRINK BAKED_BREAD/BUNS/ROLLS SOUP WAREHOUSE_SNACKS FRZN_VEGETABLE/VEG_DSH VALUE_ADDED_VEGETABLES REFRIGERATED",30.39,30.23,13,12,0,0,0,0,0,1,0,1,0,0,0,1,0,0,0,0,0,0,0,0,0,0,1,0,0,0,0,0,1,0,0,0,0,1,0,0,0,0,0,0,1,25.87,8.11,14,0.0647618934095358,0.0433226227690525
117,288,"DINNER_MXS:DRY FLOUR_&_MEALS FRZN_MEAT/MEAT_DINNERS HOT_CEREAL REFRGRATD_JUICES/DRNKS TOMATOES FLUID_MILK_PRODUCTS VEGETABLES_SALAD CANNED_JUICES FRUIT_-_SHELF_STABLE BAKED_BREAD/BUNS/ROLLS CONDIMENTS/SAUCES APPLES TROPICAL_FRUIT WATER_-_CARBONATED/FLVRD_DRINK CHEESE PNT_BTR/JELLY/JAMS YOGURT VEGETABLES_-_SHELF_STABLE FACIAL_TISS/DNR_NAPKIN",30.23,19.44,12,23,0,0,0,0,0,1,0,1,0,0,0,1,0,0,0,0,0,0,0,0,0,0,1,0,0,0,0,0,1,0,0,0,0,1,0,0,0,0,0,0,1,25.87,8.11,13,0.0647618934095358,0.0433226227690525
117,300,"BAKING_NEEDS CANDY_-_PACKAGED HOT_CEREAL FROZEN_MEAT VEGETABLES_SALAD REFRGRATD_JUICES/DRNKS CANNED_JUICES FRZN_MEAT/MEAT_DINNERS TOMATOES BAKED_BREAD/BUNS/ROLLS WATER_-_CARBONATED/FLVRD_DRINK CONDIMENTS/SAUCES",19.44,11.55,6,13,0,0,0,0,0,1,0,1,0,0,0,1,0,0,0,0,0,0,0,0,0,0,1,0,0,0,0,0,1,0,0,0,0,1,0,0,0,0,0,0,1,25.87,8.11,12,0.0647618934095358,0.0433226227690525
117,306,"EGGS REFRGRATD_JUICES/DRNKS FLUID_MILK_PRODUCTS SOFT_DRINKS LUNCHMEAT CRACKERS/MISC_BKD_FD BAKED_BREAD/BUNS/ROLLS TROPICAL_FRUIT",11.55,36.98,5,9,0,0,0,0,0,1,0,1,0,0,0,1,0,0,0,0,0,0,0,0,0,0,1,0,0,0,0,0,1,0,0,0,0,1,0,0,0,0,0,0,1,25.87,8.11,6,0.0647618934095358,0.0433226227690525
117,311,"COCOA_MIXES REFRGRATD_JUICES/DRNKS FLUID_MILK_PRODUCTS SEAFOOD_-_SHELF_STABLE FROZEN_PIE/DESSERTS SPICES_&_EXTRACTS APPLES TEAS CANNED_JUICES BAKED_BREAD/BUNS/ROLLS BACON FRZN_BREAKFAST_FOODS DRY_BN/VEG/POTATO/RICE FRZN_VEGETABLE/VEG_DSH WATER_-_CARBONATED/FLVRD_DRINK TROPICAL_FRUIT CHEESE SEAFOOD_-_FROZEN PNT_BTR/JELLY/JAMS POPCORN REFRGRATD_DOUGH_PRODUCTS",36.98,46.1,11,22,0,0,0,0,0,1,0,1,0,0,0,1,0,0,0,0,0,0,0,0,0,0,1,0,0,0,0,0,1,0,0,0,0,1,0,0,0,0,0,0,1,25.87,8.11,5,0.0647618934095358,0.0433226227690525
117,322,"REFRGRATD_DOUGH_PRODUCTS EGGS REFRGRATD_JUICES/DRNKS BAKED_SWEET_GOODS POPCORN GRAPES APPLES SOUP DRY_MIX_DESSERTS BAKED_BREAD/BUNS/ROLLS HOUSEHOLD_CLEANG_NEEDS VEGETABLES_-_SHELF_STABLE TOMATOES TROPICAL_FRUIT WATER_-_CARBONATED/FLVRD_DRINK COLD_AND_FLU HOT_CEREAL FLUID_MILK_PRODUCTS FACIAL_TISS/DNR_NAPKIN REFRIGERATED SEAFOOD-FRESH",46.1,25.59,8,26,0,0,0,0,0,1,0,1,0,0,0,1,0,0,0,0,0,0,0,0,0,0,1,0,0,0,0,0,1,0,0,0,0,1,0,0,0,0,0,0,1,25.87,8.11,11,0.0647618934095358,0.0433226227690525
117,330,"FRZN_MEAT/MEAT_DINNERS FLUID_MILK_PRODUCTS FRZN_VEGETABLE/VEG_DSH APPLES ANALGESICS FD_WRAPS/BAGS/TRSH_BG CANNED_JUICES BAKING_MIXES HOT_CEREAL SALAD_MIX BAKED_BREAD/BUNS/ROLLS CHEESE CANDY_-_CHECKLANE WATER_-_CARBONATED/FLVRD_DRINK FRUIT_-_SHELF_STABLE SEAFOOD_-_SHELF_STABLE TOMATOES TROPICAL_FRUIT",25.59,17.43,5,20,0,0,0,0,0,1,0,1,0,0,0,1,0,0,0,0,0,0,0,0,0,0,1,0,0,0,0,0,1,0,0,0,0,1,0,0,0,0,0,0,1,25.87,8.11,8,0.0647618934095358,0.0433226227690525
117,335,"REFRGRATD_JUICES/DRNKS CHARCOAL_AND_LIGHTER_FLUID HEAT/SERVE SOUP POTATOES TOMATOES PNT_BTR/JELLY/JAMS TROPICAL_FRUIT WATER_-_CARBONATED/FLVRD_DRINK MARGARINES FRUIT_-_SHELF_STABLE COFFEE",17.43,27.85,3,14,0,0,0,0,0,1,0,1,0,0,0,1,0,0,0,0,0,0,0,0,0,0,1,0,0,0,0,0,1,0,0,0,0,1,0,0,0,0,0,0,1,25.87,8.11,5,0.0647618934095358,0.0433226227690525
117,338,"ONIONS VEGETABLES_-_SHELF_STABLE CARROTS MEAT_-_SHELF_STABLE DRY_NOODLES/PASTA PASTA_SAUCE CONDIMENTS/SAUCES BAKED_SWEET_GOODS MILK_BY-PRODUCTS FLUID_MILK_PRODUCTS CHEESE TOYS_AND_GAMES FRZN_MEAT/MEAT_DINNERS",27.85,40.83,8,22,0,0,0,0,0,1,0,1,0,0,0,1,0,0,0,0,0,0,0,0,0,0,1,0,0,0,0,0,1,0,0,0,0,1,0,0,0,0,0,0,1,25.87,8.11,3,0.0647618934095358,0.0433226227690525
117,346,"FRZN_MEAT/MEAT_DINNERS REFRGRATD_JUICES/DRNKS BAKED_SWEET_GOODS FLUID_MILK_PRODUCTS BAKING_MIXES SALAD_MIX ORGANICS_FRUIT_&_VEGETABLES BAKED_BREAD/BUNS/ROLLS SEAFOOD_-_FROZEN SOUP TOMATOES REFRGRATD_DOUGH_PRODUCTS SNACK_NUTS FRUIT_-_SHELF_STABLE ICE_CREAM/MILK/SHERBTS BATH_TISSUES TROPICAL_FRUIT WATER_-_CARBONATED/FLVRD_DRINK HOT_CEREAL FRZN_VEGETABLE/VEG_DSH PAPER_TOWELS POPCORN PORK",40.83,30.2,11,24,0,0,0,0,0,1,0,1,0,0,0,1,0,0,0,0,0,0,0,0,0,0,1,0,0,0,0,0,1,0,0,0,0,1,0,0,0,0,0,0,1,25.87,8.11,8,0.0647618934095358,0.0433226227690525
117,357,"ONIONS HOT_CEREAL REFRGRATD_JUICES/DRNKS APPLES FROZEN_MEAT TEAS FRUIT_-_SHELF_STABLE COLD_CEREAL COFFEE WATER_-_CARBONATED/FLVRD_DRINK TROPICAL_FRUIT CHEESE FRZN_MEAT/MEAT_DINNERS COCOA_MIXES TOMATOES CANDY_-_PACKAGED",30.2,34.76,9,17,0,0,0,0,0,1,0,1,0,0,0,1,0,0,0,0,0,0,0,0,0,0,1,0,0,0,0,0,1,0,0,0,0,1,0,0,0,0,0,0,1,25.87,8.11,11,0.0647618934095358,0.0433226227690525
117,366,"FROZEN_MEAT BAKED_SWEET_GOODS SALAD_MIX REFRGRATD_JUICES/DRNKS HEAT/SERVE VEGETABLES_-_SHELF_STABLE FLUID_MILK_PRODUCTS DINNER_MXS:DRY TOMATOES FRUIT_-_SHELF_STABLE PNT_BTR/JELLY/JAMS BAKED_BREAD/BUNS/ROLLS WATER_-_CARBONATED/FLVRD_DRINK TROPICAL_FRUIT HOT_CEREAL SALD_DRSNG/SNDWCH_SPRD PORK",34.76,24.09,8,20,0,0,0,0,0,1,0,1,0,0,0,1,0,0,0,0,0,0,0,0,0,0,1,0,0,0,0,0,1,0,0,0,0,1,0,0,0,0,0,0,1,25.87,8.11,9,0.0647618934095358,0.0433226227690525
117,374,"ORGANICS_FRUIT_&_VEGETABLES HOT_CEREAL TOMATOES FRZN_VEGETABLE/VEG_DSH FROZEN_PIE/DESSERTS BAKED_BREAD/BUNS/ROLLS CANDY_-_CHECKLANE SEAFOOD_-_FROZEN DRY_MIX_DESSERTS SALAD_MIX WATER_-_CARBONATED/FLVRD_DRINK BATH_TISSUES TROPICAL_FRUIT FACIAL_TISS/DNR_NAPKIN",24.09,35.09,8,15,0,0,0,0,0,1,0,1,0,0,0,1,0,0,0,0,0,0,0,0,0,0,1,0,0,0,0,0,1,0,0,0,0,1,0,0,0,0,0,0,1,25.87,8.11,8,0.0647618934095358,0.0433226227690525
117,382,"CHEESE FROZEN_PIZZA FROZEN_PIE/DESSERTS BAKED_BREAD/BUNS/ROLLS FROZEN_BREAD/DOUGH EGGS FLUID_MILK_PRODUCTS BAKED_SWEET_GOODS TROPICAL_FRUIT",35.09,42.27,4,19,0,0,0,0,0,1,0,1,0,0,0,1,0,0,0,0,0,0,0,0,0,0,1,0,0,0,0,0,1,0,0,0,0,1,0,0,0,0,0,0,1,25.87,8.11,8,0.0647618934095358,0.0433226227690525
117,386,"VEGETABLES_-_ALL_OTHERS SOFT_DRINKS MEAT_-_SHELF_STABLE ONIONS PEPPERS-ALL POTATOES PIES FROZEN_PIE/DESSERTS BAKED_BREAD/BUNS/ROLLS SMOKED_MEATS",42.27,30.85,1,16,0,0,0,0,0,1,0,1,0,0,0,1,0,0,0,0,0,0,0,0,0,0,1,0,0,0,0,0,1,0,0,0,0,1,0,0,0,0,0,0,1,25.87,8.11,4,0.0647618934095358,0.0433226227690525
117,387,"BAKED_BREAD/BUNS/ROLLS POTATOES TOMATOES MARGARINES APPLES CANNED_JUICES MELONS CRACKERS/MISC_BKD_FD FRZN_MEAT/MEAT_DINNERS TROPICAL_FRUIT FRZN_VEGETABLE/VEG_DSH HOT_CEREAL PAPER_TOWELS POPCORN ICE_CREAM/MILK/SHERBTS BEEF CANDY_-_PACKAGED",30.85,11.07,3,18,0,0,0,0,0,1,0,1,0,0,0,1,0,0,0,0,0,0,0,0,0,0,1,0,0,0,0,0,1,0,0,0,0,1,0,0,0,0,0,0,1,25.87,8.11,1,0.0647618934095358,0.0433226227690525
117,390,"SOFT_DRINKS BAKED_BREAD/BUNS/ROLLS SALD_DRSNG/SNDWCH_SPRD FROZEN_PIE/DESSERTS TROPICAL_FRUIT OLIVES",11.07,28.01,4,10,0,0,0,0,0,1,0,1,0,0,0,1,0,0,0,0,0,0,0,0,0,0,1,0,0,0,0,0,1,0,0,0,0,1,0,0,0,0,0,0,1,25.87,8.11,3,0.0647618934095358,0.0433226227690525
118,244,"GASOLINE-REG_UNLEADED",15.12,84.43,11,1,0,0,0,1,0,0,0,1,0,0,0,1,0,0,0,0,0,0,0,0,0,1,0,0,0,0,0,0,0,1,0,0,1,0,0,0,0,0,0,0,1,52.17,6.68,3,0.188934598943463,0.0199880021512029
118,255,"LUNCHMEAT FRZN_MEAT/MEAT_DINNERS BABY_FOODS BAKED_BREAD/BUNS/ROLLS BAG_SNACKS CANDLES/ACCESSORIES CANDY_-_PACKAGED FRZN_VEGETABLE/VEG_DSH FLUID_MILK_PRODUCTS COOKIES/CONES COLD_CEREAL ORAL_HYGIENE_PRODUCTS DOMESTIC_WINE COFFEE EGGS TROPICAL_FRUIT CANNED_JUICES FEMININE_HYGIENE CHEESE BOOKSTORE",84.43,19.37,1,37,0,0,0,1,0,0,0,1,0,0,0,1,0,0,0,0,0,0,0,0,0,1,0,0,0,0,0,0,0,1,0,0,1,0,0,0,0,0,0,0,1,52.17,6.68,11,0.188934598943463,0.0199880021512029
118,256,"PAPER_HOUSEWARES CAT_FOOD MAGAZINE",19.37,12.26,9,3,0,0,0,1,0,0,0,1,0,0,0,1,0,0,0,0,0,0,0,0,0,1,0,0,0,0,0,0,0,1,0,0,1,0,0,0,0,0,0,0,1,52.17,6.68,1,0.188934598943463,0.0199880021512029
118,265,"REFRGRATD_DOUGH_PRODUCTS CHEESE BREAKFAST_SAUSAGE/SANDWICHES",12.26,25,1,4,0,0,0,1,0,0,0,1,0,0,0,1,0,0,0,0,0,0,0,0,0,1,0,0,0,0,0,0,0,1,0,0,1,0,0,0,0,0,0,0,1,52.17,6.68,9,0.188934598943463,0.0199880021512029
118,266,"GASOLINE-REG_UNLEADED",25,3.29,2,1,0,0,0,1,0,0,0,1,0,0,0,1,0,0,0,0,0,0,0,0,0,1,0,0,0,0,0,0,0,1,0,0,1,0,0,0,0,0,0,0,1,52.17,6.68,1,0.188934598943463,0.0199880021512029
118,268,"FLUID_MILK_PRODUCTS CAT_FOOD",3.29,108.83,2,2,0,0,0,1,0,0,0,1,0,0,0,1,0,0,0,0,0,0,0,0,0,1,0,0,0,0,0,0,0,1,0,0,1,0,0,0,0,0,0,0,1,52.17,6.68,2,0.188934598943463,0.0199880021512029
118,270,"CANNED_JUICES BAKED_BREAD/BUNS/ROLLS CAT_FOOD SALD_DRSNG/SNDWCH_SPRD COLD_AND_FLU FRZN_MEAT/MEAT_DINNERS DEODORANTS MAGAZINE HOT_CEREAL HAND/BODY/FACIAL_PRODUCTS FLUID_MILK_PRODUCTS HISPANIC FRZN_VEGETABLE/VEG_DSH PET_CARE_SUPPLIES VITAMINS TROPICAL_FRUIT DRIED_FRUIT CHEESE LUNCHMEAT CAT_LITTER PACKAGED_NATURAL_SNACKS PAPER_TOWELS",108.83,84.07,17,31,0,0,0,1,0,0,0,1,0,0,0,1,0,0,0,0,0,0,0,0,0,1,0,0,0,0,0,0,0,1,0,0,1,0,0,0,0,0,0,0,1,52.17,6.68,2,0.188934598943463,0.0199880021512029
118,287,"FRZN_MEAT/MEAT_DINNERS BAKED_BREAD/BUNS/ROLLS FRZN_VEGETABLE/VEG_DSH AIR_CARE COFFEE HOT_CEREAL CAT_FOOD FLUID_MILK_PRODUCTS SALAD_BAR CANNED_JUICES TROPICAL_FRUIT CHEESE LUNCHMEAT",84.07,25,7,33,0,0,0,1,0,0,0,1,0,0,0,1,0,0,0,0,0,0,0,0,0,1,0,0,0,0,0,0,0,1,0,0,1,0,0,0,0,0,0,0,1,52.17,6.68,17,0.188934598943463,0.0199880021512029
118,294,"GASOLINE-REG_UNLEADED",25,97.18,6,1,0,0,0,1,0,0,0,1,0,0,0,1,0,0,0,0,0,0,0,0,0,1,0,0,0,0,0,0,0,1,0,0,1,0,0,0,0,0,0,0,1,52.17,6.68,7,0.188934598943463,0.0199880021512029
118,300,"FRZN_MEAT/MEAT_DINNERS VEGETABLES_-_SHELF_STABLE AIR_CARE BAKED_BREAD/BUNS/ROLLS SALAD_MIX PNT_BTR/JELLY/JAMS FRZN_VEGETABLE/VEG_DSH STATIONERY_&_SCHOOL_SUPPLIES COFFEE_FILTERS CANDY_-_PACKAGED PET_CARE_SUPPLIES LIQUOR COFFEE FLUID_MILK_PRODUCTS TROPICAL_FRUIT CANNED_JUICES CONVENIENT_BRKFST/WHLSM_SNACKS CHEESE SALD_DRSNG/SNDWCH_SPRD COLD_CEREAL BERRIES LUNCHMEAT CAT_LITTER CANDLES/ACCESSORIES",97.18,104.32,13,41,0,0,0,1,0,0,0,1,0,0,0,1,0,0,0,0,0,0,0,0,0,1,0,0,0,0,0,0,0,1,0,0,1,0,0,0,0,0,0,0,1,52.17,6.68,6,0.188934598943463,0.0199880021512029
118,313,"FRZN_MEAT/MEAT_DINNERS BAKED_BREAD/BUNS/ROLLS DISHWASH_DETERGENTS FROZEN_PIZZA STATIONERY_&_SCHOOL_SUPPLIES GRAPES FRZN_VEGETABLE/VEG_DSH CAT_FOOD COLD_CEREAL CANDY_-_PACKAGED FLUID_MILK_PRODUCTS CRACKERS/MISC_BKD_FD TROPICAL_FRUIT CHEESE BERRIES CITRUS COFFEE HAIR_CARE_PRODUCTS BATH LUNCHMEAT BOOKSTORE CANNED_JUICES MAGAZINE BATH_TISSUES",104.32,82.94,13,38,0,0,0,1,0,0,0,1,0,0,0,1,0,0,0,0,0,0,0,0,0,1,0,0,0,0,0,0,0,1,0,0,1,0,0,0,0,0,0,0,1,52.17,6.68,13,0.188934598943463,0.0199880021512029
118,326,"FRZN_MEAT/MEAT_DINNERS BAKED_BREAD/BUNS/ROLLS FROZEN_PIZZA SALD_DRSNG/SNDWCH_SPRD CHEESE PNT_BTR/JELLY/JAMS FRZN_VEGETABLE/VEG_DSH FLUID_MILK_PRODUCTS TROPICAL_FRUIT CANNED_JUICES CONVENIENT_BRKFST/WHLSM_SNACKS BERRIES GASOLINE-REG_UNLEADED LUNCHMEAT SALAD_MIX",82.94,77.15,14,34,0,0,0,1,0,0,0,1,0,0,0,1,0,0,0,0,0,0,0,0,0,1,0,0,0,0,0,0,0,1,0,0,1,0,0,0,0,0,0,0,1,52.17,6.68,13,0.188934598943463,0.0199880021512029
118,340,"CITRUS FRZN_MEAT/MEAT_DINNERS BAKED_BREAD/BUNS/ROLLS DINNER_MXS:DRY BERRIES DOMESTIC_WINE FRZN_VEGETABLE/VEG_DSH LUNCHMEAT PET_CARE_SUPPLIES FROZEN_PIZZA COLD_CEREAL FLUID_MILK_PRODUCTS TROPICAL_FRUIT CANNED_JUICES CHEESE HOT_CEREAL BAG_SNACKS CAT_FOOD FRZN_BREAKFAST_FOODS",77.15,68.92,14,41,0,0,0,1,0,0,0,1,0,0,0,1,0,0,0,0,0,0,0,0,0,1,0,0,0,0,0,0,0,1,0,0,1,0,0,0,0,0,0,0,1,52.17,6.68,14,0.188934598943463,0.0199880021512029
118,354,"CITRUS FRZN_MEAT/MEAT_DINNERS BAKED_BREAD/BUNS/ROLLS SALD_DRSNG/SNDWCH_SPRD BAG_SNACKS PNT_BTR/JELLY/JAMS FRZN_VEGETABLE/VEG_DSH MARGARINES DINNER_MXS:DRY COLD_CEREAL FROZEN_PIZZA MISC_WINE FLUID_MILK_PRODUCTS AIR_CARE LUNCHMEAT FRZN_BREAKFAST_FOODS TROPICAL_FRUIT CANNED_JUICES DRIED_FRUIT BERRIES LAUNDRY_DETERGENTS",68.92,59.98,14,47,0,0,0,1,0,0,0,1,0,0,0,1,0,0,0,0,0,0,0,0,0,1,0,0,0,0,0,0,0,1,0,0,1,0,0,0,0,0,0,0,1,52.17,6.68,14,0.188934598943463,0.0199880021512029
118,368,"FRZN_MEAT/MEAT_DINNERS BAKED_BREAD/BUNS/ROLLS CHEESE FRZN_VEGETABLE/VEG_DSH LUNCHMEAT CANDY_-_PACKAGED CRACKERS/MISC_BKD_FD HOT_CEREAL BREAD MISC_WINE FLUID_MILK_PRODUCTS SUGARS/SWEETNERS COFFEE TROPICAL_FRUIT CANNED_JUICES ELECTRICAL_SUPPPLIES BERRIES FRZN_BREAKFAST_FOODS",59.98,20,6,29,0,0,0,1,0,0,0,1,0,0,0,1,0,0,0,0,0,0,0,0,0,1,0,0,0,0,0,0,0,1,0,0,1,0,0,0,0,0,0,0,1,52.17,6.68,14,0.188934598943463,0.0199880021512029
118,374,"GASOLINE-REG_UNLEADED",20,81.89,8,1,0,0,0,1,0,0,0,1,0,0,0,1,0,0,0,0,0,0,0,0,0,1,0,0,0,0,0,0,0,1,0,0,1,0,0,0,0,0,0,0,1,52.17,6.68,6,0.188934598943463,0.0199880021512029
118,382,"CITRUS DINNER_MXS:DRY BAKED_BREAD/BUNS/ROLLS MILK_BY-PRODUCTS FRZN_MEAT/MEAT_DINNERS FROZEN_PIZZA BEEF COLD_CEREAL SALAD_MIX CRACKERS/MISC_BKD_FD FLUID_MILK_PRODUCTS FRZN_VEGETABLE/VEG_DSH FRZN_BREAKFAST_FOODS LUNCHMEAT IRONING_AND_CHEMICALS TROPICAL_FRUIT CANNED_JUICES KITCHEN_GADGETS BERRIES SALD_DRSNG/SNDWCH_SPRD CAT_FOOD BATH_TISSUES",81.89,11.49,7,31,0,0,0,1,0,0,0,1,0,0,0,1,0,0,0,0,0,0,0,0,0,1,0,0,0,0,0,0,0,1,0,0,1,0,0,0,0,0,0,0,1,52.17,6.68,8,0.188934598943463,0.0199880021512029
118,389,"CANNED_JUICES PREPARED_FOOD",11.49,67.73,7,2,0,0,0,1,0,0,0,1,0,0,0,1,0,0,0,0,0,0,0,0,0,1,0,0,0,0,0,0,0,1,0,0,1,0,0,0,0,0,0,0,1,52.17,6.68,7,0.188934598943463,0.0199880021512029
118,396,"FRZN_MEAT/MEAT_DINNERS REFRGRATD_DOUGH_PRODUCTS AIR_CARE BAKED_BREAD/BUNS/ROLLS LUNCHMEAT FRZN_VEGETABLE/VEG_DSH CHEESE FROZEN_PIZZA COLD_CEREAL FLUID_MILK_PRODUCTS MAGAZINE TROPICAL_FRUIT CANNED_JUICES SPICES_&_EXTRACTS IMPORTED_WINE GREETING_CARDS/WRAP/PARTY_SPLY",67.73,25,4,32,0,0,0,1,0,0,0,1,0,0,0,1,0,0,0,0,0,0,0,0,0,1,0,0,0,0,0,0,0,1,0,0,1,0,0,0,0,0,0,0,1,52.17,6.68,7,0.188934598943463,0.0199880021512029
118,400,"GASOLINE-REG_UNLEADED",25,17.08,5,1,0,0,0,1,0,0,0,1,0,0,0,1,0,0,0,0,0,0,0,0,0,1,0,0,0,0,0,0,0,1,0,0,1,0,0,0,0,0,0,0,1,52.17,6.68,4,0.188934598943463,0.0199880021512029
118,405,"CANNED_JUICES CONVENIENT_BRKFST/WHLSM_SNACKS",17.08,75.9,6,3,0,0,0,1,0,0,0,1,0,0,0,1,0,0,0,0,0,0,0,0,0,1,0,0,0,0,0,0,0,1,0,0,1,0,0,0,0,0,0,0,1,52.17,6.68,5,0.188934598943463,0.0199880021512029
118,411,"DEODORANTS FRZN_MEAT/MEAT_DINNERS BEEF BAKED_BREAD/BUNS/ROLLS LUNCHMEAT GRAPES FROZEN_PIZZA CONDIMENTS/SAUCES HOT_CEREAL FRZN_VEGETABLE/VEG_DSH VEGETABLES_-_SHELF_STABLE FLUID_MILK_PRODUCTS COLD_CEREAL DOMESTIC_WINE FRZN_BREAKFAST_FOODS TROPICAL_FRUIT CANNED_JUICES FROZEN_MEAT SALD_DRSNG/SNDWCH_SPRD BERRIES BREAKFAST_SAUSAGE/SANDWICHES CRACKERS/MISC_BKD_FD",75.9,54.71,13,33,0,0,0,1,0,0,0,1,0,0,0,1,0,0,0,0,0,0,0,0,0,1,0,0,0,0,0,0,0,1,0,0,1,0,0,0,0,0,0,0,1,52.17,6.68,6,0.188934598943463,0.0199880021512029
118,424,"FRZN_MEAT/MEAT_DINNERS WATER BAKED_BREAD/BUNS/ROLLS CANNED_JUICES PNT_BTR/JELLY/JAMS COLD_CEREAL MELONS FLUID_MILK_PRODUCTS AIR_CARE FRZN_VEGETABLE/VEG_DSH FRZN_BREAKFAST_FOODS TROPICAL_FRUIT PASTA_SAUCE BERRIES SALD_DRSNG/SNDWCH_SPRD IMPORTED_WINE",54.71,16.14,2,33,0,0,0,1,0,0,0,1,0,0,0,1,0,0,0,0,0,0,0,0,0,1,0,0,0,0,0,0,0,1,0,0,1,0,0,0,0,0,0,0,1,52.17,6.68,13,0.188934598943463,0.0199880021512029
118,426,"COLD_AND_FLU IMPORTED_WINE SALADS/DIPS",16.14,88.62,11,3,0,0,0,1,0,0,0,1,0,0,0,1,0,0,0,0,0,0,0,0,0,1,0,0,0,0,0,0,0,1,0,0,1,0,0,0,0,0,0,0,1,52.17,6.68,2,0.188934598943463,0.0199880021512029
